{
  "detector_id": "sqli-auth",
  "severity": "high",
  "method": "POST",
  "url": "https://api.petstore.com/v2/inventory",
  "path": "/v2/inventory",
  "title": "SQL Injection in Inventory Endpoint",
  "subcategory": "sqli",
  "cwe": "CWE-89",
  "owasp": "A03:2021",
  "confidence": 85,
  "status": "open",
  "req": {
    "method": "POST",
    "url": "https://api.petstore.com/v2/inventory",
    "headers": {
      "Content-Type": "application/json"
    },
    "body": "{\"query\": \"SELECT * FROM inventory WHERE id = 1' OR 1=1\"}"
  },
  "res": {
    "status_code": 500,
    "headers": {
      "Server": "nginx/1.18.0"
    },
    "body": "Internal Server Error: You have an error in your SQL syntax"
  },
  "match": "error in your SQL syntax",
  "run_id": "run-20240115-1045",
  "created_at": "2024-01-15T10:40:00Z"
}
